{
  "$schema": "./docs/project-state.schema.json",
  "schemaVersion": 1,
  "lastUpdated": "2026-10-07",
  "project": {
    "name": "MissionChief Command Nexus",
    "repository": "Team-Killing-Bastards/MissionChief-Command-Nexus",
    "defaultBranch": "main",
    "canonicalUserscript": "src/missionchief-command-nexus.user.js",
    "technicalOwner": "MartyBlyth",
    "documentationSupport": "Conroy1988"
  },
  "authority": {
    "conflictRule": "Current extension source and verified Store release evidence take precedence for the Chrome product. distribution records the public channel separately from the retained canonical/production userscript records. Historical handovers, the Google Memory Bank and conversation memory cannot silently override them.",
    "precedence": [
      {
        "rank": 1,
        "source": "Current versioned extension source and verified Store release evidence",
        "path": "extension-candidates/3.0.43.205/extension/manifest.json",
        "purpose": "Current extension entry points and version; source equality with a Store package requires separate evidence"
      },
      {
        "rank": 2,
        "source": "Machine-readable current project state",
        "path": "project-state.json",
        "purpose": "Current versions, active decisions, evidence, risks and next work"
      },
      {
        "rank": 3,
        "source": "Accepted architecture decision records",
        "path": "docs/decisions/README.md",
        "purpose": "Why important contracts exist and what supersedes them"
      },
      {
        "rank": 4,
        "source": "Generated human-readable project state",
        "path": "docs/PROJECT_STATE.md",
        "purpose": "Readable view generated from project-state.json"
      },
      {
        "rank": 5,
        "source": "Sanitised evidence summaries and linked raw diagnostics",
        "path": "docs/evidence/README.md",
        "purpose": "Evidence supporting decisions without becoming current truth"
      },
      {
        "rank": 6,
        "source": "Connected Google Memory Bank and conversation memory",
        "path": "",
        "purpose": "Handover convenience and historical navigation only"
      }
    ]
  },
  "canonical": {
    "status": "published",
    "version": "3.0.43",
    "sourceBytes": 2080437,
    "sourceSha256": "00473770dcad063edd9596fd855bb6bc2bb1dc72ca41ddae4460e459943e261b",
    "components": {
      "missionFinder": "10.6.180",
      "resourceAdministration": "4.2.9",
      "unitNaming": "3.3.28",
      "stationNaming": "1.3.23",
      "personnelAssignment": "1.3.12"
    }
  },
  "production": {
    "version": "3.0.43",
    "tag": "v3.0.43",
    "releaseCommit": "b8e5e46fe4b4acd7c028ee615416a048a853aac6",
    "releaseUrl": "https://github.com/Team-Killing-Bastards/MissionChief-Command-Nexus/releases/tag/v3.0.43",
    "publishedAt": "2026-09-03T19:35:44Z",
    "asset": {
      "name": "MissionChief-Command-Nexus-3.0.43.user.js",
      "bytes": 2080437,
      "sha256": "00473770dcad063edd9596fd855bb6bc2bb1dc72ca41ddae4460e459943e261b"
    },
    "releaseStatus": "published",
    "liveValidationStatus": "pending",
    "liveValidationNote": "Repository, release-asset, deployment and Discord verification passed. Live validation now requires a normal Auto Mode run with resource or trained-personnel shortages, followed by an export proving stationIssueSummary, vehicleIssueSummary and per-mission candidate evidence identify the responsible stations/vehicles/rejection reasons before any selection rules are changed."
  },
  "architecture": {
    "summary": "One lightweight parent controller owns exactly one heavy managed worker realm at a time. Mission Worker A handles mission selection and dispatch; on-demand Transport Worker B handles one exact personal patient or prisoner transport. No dormant mission preload exists.",
    "workerA": {
      "role": "MISSION_A",
      "owns": [
        "mission requirements and complete vehicle-list loading",
        "Unit Finder and trained-personnel verification",
        "vehicle selection and Dispatch",
        "mission queue progression and safe mission-boundary handoff"
      ],
      "mustNot": [
        "select patient or prisoner destinations",
        "remain on a verified transport route",
        "overlap an active Worker B"
      ]
    },
    "workerB": {
      "role": "TRANSPORT_B",
      "owns": [
        "one exact personal Radio request",
        "patient hospital destination selection",
        "prisoner cell or release handling",
        "proof that the exact request cleared"
      ],
      "mustNot": [
        "run Unit Finder or mission Auto Mode",
        "select mission vehicles or click Dispatch",
        "process Alliance transport",
        "overlap or promote into Worker A"
      ]
    },
    "invariants": [
      "Worker A is removed before Worker B starts.",
      "Worker B is removed before a fresh Worker A starts.",
      "PIPELINE_PRELOAD_COUNT remains zero; B is reserved for transport.",
      "Personal transport is exact-identity, oldest-first and fail-closed; Alliance rows are excluded.",
      "Prisoner release result and 404 routes are terminal results, never reusable mission URLs.",
      "A parent-appointed managed Worker A is terminal positive authority before DOM readiness and visible-primary ranking.",
      "Visible Mission Control and manual actions remain independent of background worker ownership.",
      "Durable station, vehicle, personnel, training and user-setting data are never cleared by runtime recovery.",
      "Visible-page sleep recovery requires at least 90 seconds; hidden-page recovery requires at least three minutes.",
      "Nexus Realism geographic data is imported and classified on the VPS into PostgreSQL/PostGIS; routine browser map movement must not parse PBF data or call live Overpass.",
      "Realism client reads are bounded, read-only Nexus API queries and remain operationally separate from Mission Worker A, Transport Worker B and collector event ingestion."
    ]
  },
  "lockedDecisions": [
    {
      "id": "ADR-0001",
      "title": "Durable project records and authority order",
      "file": "docs/decisions/0001-project-record-authority.md",
      "status": "accepted",
      "introducedIn": "repository maintenance 2026-08-31"
    },
    {
      "id": "ADR-0002",
      "title": "Mission Worker A and Transport Worker B are separate serialized roles",
      "file": "docs/decisions/0002-mission-worker-a-transport-worker-b.md",
      "status": "accepted",
      "introducedIn": "3.0.35"
    },
    {
      "id": "ADR-0003",
      "title": "Only exact personal Radio transport enters Worker B",
      "file": "docs/decisions/0003-personal-transport-queue-scope.md",
      "status": "accepted",
      "introducedIn": "3.0.35"
    },
    {
      "id": "ADR-0004",
      "title": "Qualification-sensitive dispatch is fail-closed",
      "file": "docs/decisions/0004-trained-personnel-fail-closed.md",
      "status": "accepted",
      "introducedIn": "existing production contract"
    },
    {
      "id": "ADR-0005",
      "title": "Prisoner release routes are terminal results",
      "file": "docs/decisions/0005-prisoner-release-terminal-routes.md",
      "status": "accepted",
      "introducedIn": "3.0.39"
    },
    {
      "id": "ADR-0006",
      "title": "Managed Worker A admission is terminal and wake recovery is role-aware",
      "file": "docs/decisions/0006-managed-worker-admission-and-wake-recovery.md",
      "status": "accepted",
      "introducedIn": "3.0.40"
    },
    {
      "id": "ADR-0007",
      "title": "Independent verified Edge Store delivery",
      "file": "docs/decisions/0007-edge-store-release.md",
      "status": "accepted",
      "introducedIn": "Edge extension 3.0.43.15"
    },
    {
      "id": "ADR-0008",
      "title": "VPS-backed PostGIS is the Realism Map data authority",
      "file": "docs/decisions/0008-realism-map-vps-data-plane.md",
      "status": "accepted",
      "introducedIn": "Realism Map Phase 1 (2026-09-20)"
    },
    {
      "id": "ADR-0009",
      "title": "Chrome Store is the current distribution authority",
      "status": "accepted",
      "introducedIn": "3.0.43.205",
      "file": "docs/decisions/0009-chrome-distribution.md"
    }
  ],
  "evidence": [
    {
      "id": "RUN-2026-08-30-V3039",
      "title": "Strong v3.0.39 live run and memory-risk baseline",
      "file": "docs/evidence/live-run-v3.0.39-2026-08-30.md",
      "kind": "sanitised-summary",
      "supports": [
        "MEMORY-001",
        "A/B functional stability"
      ]
    },
    {
      "id": "RUN-2026-09-01-V3040-HOT-BRAKES",
      "title": "Hot Brakes standalone Airfield command mapping failure",
      "file": "docs/evidence/hot-brakes-airfield-command-v3.0.40-2026-09-01.md",
      "kind": "sanitised-summary",
      "supports": [
        "Airfield Firefighting Command Vehicle mapping"
      ]
    },
    {
      "id": "RUN-2026-09-02-V3041-ARMED-AUTO",
      "title": "Auto Armed Response false shortage and partial dispatch",
      "file": "docs/evidence/auto-armed-personnel-and-partial-dispatch-v3.0.41-2026-09-02.md",
      "kind": "sanitised-summary",
      "supports": [
        "bounded trained-personnel final retry",
        "no partial dispatch on incomplete coverage"
      ]
    },
    {
      "id": "RUN-2026-09-03-V3042-STATION-DIAGNOSTICS",
      "title": "Shortage station diagnostics gap",
      "file": "docs/evidence/shortage-station-diagnostics-gap-v3.0.42-2026-09-03.md",
      "kind": "sanitised-summary",
      "supports": [
        "station-level shortage evidence",
        "candidate rejection diagnostics"
      ]
    },
    {
      "id": "RUN-2026-09-20-REALISM-PHASE1",
      "title": "Realism Map Phase 1 VPS/PostGIS validation",
      "file": "docs/evidence/realism-backend-phase1-2026-09-20.md",
      "kind": "sanitised-summary",
      "supports": [
        "REALISM-001",
        "ADR-0008"
      ]
    }
  ],